,Text
422,rt novieverest anytime kenneth okonkwo goes air pdapc group he always leaves them angry end they finished politics 
423, mzanona atrupar rolling on the floor laughing rolling on the floor laughing rolling on the floor laughing rolling on the floor laughing rolling on the floor laughing rolling on the floor laughing rolling on the floor laughing rolling on the floor laughing rolling on the floor laughing rolling on the floor laughing hate s crashing burning finally
424,rt gabrielrockhill my latest zizek rose fame promoting pomo radlib theory against marxism claiming communism worst catast 
425,rt denooh  only hate mfs motivate them
426,rt derpydrake lets kick off  breeze arkees comes greet you first time but course backfires worst t 
427, hate when be quiet public places or any place people want whole room hear what their phone
428,rt tekmayor mikano children atiku has most experience he was vp obasanjo there was an economic boom blah blah daniel bwa 
429,rt chinnwee hate all soft life luxury life day life high value woman man feminine energy passenger princess healed l 
430,rt chenchenwrites saying love you your friends regular basis really nice hate idea should only be roma 
431,rt togejustvibin jisoo s birthday but her who has gift her dear blinks all income from her channel will be donat 
432,carol had worst luck children 
433,rt starboy today congress made their worst blunder n exposed itself completely former raw chief as dulat joined bharat jodo yatra t 
434,rt babyraikan clearly vid ohm look significant other angry they are fighting I am curious why fans keep saying ohm was tire 
435,rt tribelaw most embarrassing trump was he offered media availability mar lago not single cable news outlet inc 
436, detest celebrity culture though have no desire meet celebrities only famous people I would want meet are dead writers artists ye happens be one living artist connect major level ye 
437,best worst time year your femme friends as we are overwhelmed advertisements heart shaped decor 
438,rt bdtrelilbrother hate vision boards cause why am cutting chanel signs out damn magazine
439,rt mubashshera dev ka toh pata nahi but never make iqbal angry rolling on the floor laughing ok hand light skin tone naumrakiseemaho 
440,rt dawa musa did not undergo any post traumatic therapy or any formal rehabilitation back civil society twitter was my only remedy 
441,rt kthcrave hobiglitters nobody s fault when man was purposely feeding shippers purpose knowing tae was getting hate did 
442,rt smc dc expecting you be polite while there radio silence about guy bench mentioned eastwood s texts married 
443, stardustaligned hate yoowufmandka cannot wait
444, robert chase senior process making rash decision worst made decision quickly call sending player locker room then process how which takes time
445,rt simonharris mbd hi kathryn spotted your letter daily express I am not even angry anymore if you are twitter then please ge 
446,rt peteneville those who not fully understand what up nhs here thread you might help I am consulta 
447,you ez amp  teacher got little angry       
448, emmibear lolakas hate 
449,rt kimguilfoyle joe biden cheers historic year record crime record inflation record illegal immigration record gas prices worst stoc 
450, hate being significant other vulnerable pero cannot help I do not know kung kaya ko pa ba
451,rt wishleeluck really miss when instagram was pictures low key hate all these reels
452, wandereriuvr yeah love silly fishing weapon actually one best picks her cause all my homies hate weapon banner
453,extremely online putin supporters twitter get very sad angry when they are no longer given negative attention their outrageous accusations everyone who shows solidarity ukrainian defense against an illegal military invasion nazi sympathizer sad 
454,rt kumarga all these advancements were propelled by hate misandry when feminists does not need men then we men really nee 
455,rt riviolle because one pointing out feminine features without degrading character while other thinking from thei 
456,rt quenblackwell hate you minimalistic grayscale bitches destruction you cause 
457,rt balltalk teams who could be upset alert tonight kansas virginia new mexico all these top squad teams are road 
458, maxzsz thank you is terrible comment down what you think worst anime all time not get someone s ass over damn header bruh he never even said anything about images 
459,rt seahorse bad shift lotta flu lotta covid lotta pneumonia very sick people long waits offload ambulances no beds no flow 
460, hate territorial bitch be going fr but soon as they heard somebody they know touched you end world like bitch you got whole amman face with tears of joy tired face why we cannot have fun not cock block me cause not tryna be no side nigga
461, antwindmill jkoff mickmazzo kelledin jammingontheone blueselmwood patriot gypsy againmothra magaphoenix digimalice tshadowknow tip ct pismojado blueresin klhu vincegottalotta trumpcrazytrain synyster lordbutters craigcastleber karlton teekeemon angryfleas emerichathome educatingtrump webguytv tommiestephsyup trumplost tastymorsel ultraglamma crogers brulephd mistressredwasp craig thetennpatriot collusiontech billenjoylife section kleeontheright angry mema missledu jonrfleming beastoforem nobusinessyours inugamiz kimmsue hofountains trumpster caperloo earthone face with tears of joy face with tears of joy face with tears of joy cause poor dude giant liar he right group though
462,bruh fuckin hate love bird app 
463,rt unusual whales police car light breaking police car light have released full trading report politicians despite being worst market s 
464,rt bleszmeachuu love hate relationship jae amp woobear hshshshshs 
465,waiting someone s reply worst thing ever woman with white cane light skin tone could not be me clown face 
466, violetvelaryon worst thing they justify themselves by saying they were bad people but they still mock jaeherys fingers or jaehera 
467,rt brexitbuster try very hard avoid using c word social media deeply offensive upsets many people fact sh 
468,rt peteneville those who not fully understand what up nhs here thread you might help I am consulta 
469, wopizza timcast you know what you have  o very angry letter 
470, generalbitch momsliberty porn does not belong public taxpayer funded libraries especially give access minors you want run porn shop open an adult book store get one soros endless ngos fund you are groomer best pedophile worst you picked fight 
471,rt pammy ds have no energy hate anyone seriously have no space my heart carry shit around either love you wish why 
472, vikassng realajay shrishtysays ihrithik pm modi ji desh ke saath hai tum jaise andh bhakt zindagi bhar rote rahoge kabhie emergency pade toh sirf family hi kaam ayegi tumhare not applicable bjp se koi ayega not applicable twitter se koi congress se bhi koi nhi ayega waise tum toh congress ko hate karte bachpana chodo padhai kro 
473, thomasjamesgray want hate but cannot 
474,rt quanetriagenshi I am still thinking hoping we will get quest where haitham will get angry will keep telling kaveh move 
475, isabeloakeshott london should not be deserted streets need full full angry people 
476,rt atptour another adelaide upset popyrin finishes off auger aliassime   score his third career top win adelaidetennis 
477,rt kingpullo  good thing know who your loyal friends are but also very important know who your worst enemy too 
478, hate school but can restrict easy again significant other fine heart suit 
479, maiden many wooers why o x er ie r loften chooses worst 
480, bmaas mixonmania really hate see tie be pushed onto both teams but even more I would hate see bills assigned loss situation or bengals receive win fashion 
481,rt bdtrelilbrother bitches be bonding cause they hate alike face with tears of joy face with tears of joy face with tears of joy face with tears of joy face with tears of joy face with tears of joy face with tears of joy face with tears of joy corny
482, formulahrs mfs replies upset because dude dont wanna lose money skull 
483, thebinmasterpt wrong love sonny but hate him nina both brilliant artists how can he still hate brad what he did michael forgive nina what she did his entire family not watch those scenes they make me want vomit 
484, maanshi worst food ever
485, hate mfs who are like where are you are significant other tucking clingy like where you live when where we have sex like come me baby
486, keolicious j ai grave hâte de l épisode cette semaine perso
487,rt petehaileynbcs overwhelming reaction wentz trade first was not gonna work there were selling points his arm 
488,rt britneyscrave not wanna hear how your fave had worse hate train than britney spears considering she got bodyshamed slammed f 
489,I have switched less serious less angry tone account lot more shitposting random stream thought shit interesting my follower count has stayed around same level expected drop way more to be honest not worry I am still an angry communist 
490,rt missouriprison there are reports staff being assaulted jefferson city correctional center yesterday house c wing no injur 
491,rt abrahamhamadeh you not have believe conspiracies admit maricopa county s election day was worst run modern hist 
492,wrong nobody dangerous worst 
493,rt newtannies nwjns hate significant other forced weird they are storytellers like any other idols actors who act represent mess 
494,rt hadithoftheday narrated abu dharr ra  messenger allah peace be upon him said us when one you becomes angry while st 
495, sarahsedigh maybe lot us forget we all have us very powerful can make one love us hate us idol us or even verdamn us how we use power words 
496,rt anime time send off stinkers read find our staff s picks worst anime your choices best 
497,rt chinnwee hate all soft life luxury life day life high value woman man feminine energy passenger princess healed l 
498,rt baujidesi while image khakee already not good often people khakee make worst by their action pnb employee deogarh 
499,oh significant other have many reasons be angry mbc today treating monsta x like they are arent seniors other groups then uploading fancams all members other groups then only uploading ateez 
500,rt neevehoke honestly not understand people dissing itv shows based their budget knowing ours much smaller industry 
501, wusijiex right hate them
502,how one america s best known film critics went from driving delivery truck getting angry phone calls home from sylvester stallone our host carlos frias gets rodriguezrene voice listen or get wlrn sundial your podcast app 
503,rt wayydaminn I am significant other chill laid back like really not be caring why hate when mfs go out their way be weird you don 
504, saranghaeyome thekhabritweets hlo youtube channel j thaker said abdu winning chance zero he only guest am very upset statement 
505, baseballbear will always be cringe watch people be obsessed about possibly worst group people history instead all cool shit happened 
506,rt pammy ds have no energy hate anyone seriously have no space my heart carry shit around either love you wish why 
507, dave odo mr magoo ncdavelife liamkav andrewnutter takethatct ivalkyrie top muppetries jayboy fudyou justdeano mcfunny volpiranyas katieorourke coralblob sc over the top mchaelm hauxton mutzuk fionnmaccool tonybaduy greenboat skepticalmutant carlsmythe mamadeb monstercoyliar markoftec ghoppe crabb vicki doritmi jarbot provaxtexan frankdelia doctorfeelgde i am joli anne jonintn andrewlazarus alaskacryptogi tenebra agoldsmithesq swedishchf clownworld bobo wendy lynnette docstardust justplayingwin dcgreenzone estespga gobantwo stevenmosher zaynjaffer face screaming in fear face screaming in fear face screaming in fear face screaming in fear unbelievable really you are worst 
508, lsrfm global le sserafim im lesserafim hate being european
509,what beautiful music my ears when my aunt calls me sophie warner not by my real name will not say because really hate my real name
510, hate being not good enough mother you hope have chance being good one not mean be as napa ya tuhan aku ini pensive face 
511,rt toritse  worst part about burna concert was not even waiting when people parked outside come out realize 
512,rt unusual whales police car light breaking police car light have released full trading report politicians despite being worst market s 
513, hate fucking dude
514,rt mattxiv people like steven crowder will see fat person tell them they should exercise get healthier then they 
515,rt nightshiftmd I am my sister s bedside we think she contracted covid over weekend she severe respiratory distress 
516, os somkheleomkhulu hate him face with tears of joy face with tears of joy face with tears of joy face with tears of joy 
517,rt theholisticpsyc having partner who grew up home adults who could not self regulate can be difficult people from these homes 
518,rt pammy ds have no energy hate anyone seriously have no space my heart carry shit around either love you wish why 
519,
520, cannot believe bitch really moved halfway across country continue stalking me sending me anonymous hate mail tumblr get fucking life
521,I have recently started doing thing where every time want argue twitter write my angry reply then exit out app before posting truly best thing I have done my mental health since wellbutrin 
522,rt pierrefleury worst lie we have told men specifically once they find person they are meant be they are going t 
523,rt main valkyrie  time eliminate once all cancerous parasite gaming communityhis hate speech continuous hara 
524,rt mohataul maulana haq nawaz jhangvi had boldly publicized these sentiments declared shia be worst brand kuffar 
525,rt shaksingh ani hate against narendra modi has become hate against india by way malda place where most number bangaldeshi 
526, visegrad kyrgyzstan upset but kyrgyzstan does not even teach their own kyrgyzs language their own kyrgyzstan schools 
527,rt chinnwee hate all soft life luxury life day life high value woman man feminine energy passenger princess healed l 
528, lolly hate hoes cardiac arrest his heart stopped know force can cause but video not look like too much force from higgins significant other I am wondering something they bout find 
529,rt chinnwee hate all soft life luxury life day life high value woman man feminine energy passenger princess healed l 
530,rt jeongjoahn growing deeper means absorbing your pain ok going be all okay if they not worst thing you can 
531,rt islandyke had miss my shift friday due health complications had low blood sugar could not properly take food becau 
532, worst way miss someone with o x  r lbe 
533,rt novieverest anytime kenneth okonkwo goes air pdapc group he always leaves them angry end they finished politics 
534, mzanona atrupar rolling on the floor laughing rolling on the floor laughing rolling on the floor laughing rolling on the floor laughing rolling on the floor laughing rolling on the floor laughing rolling on the floor laughing rolling on the floor laughing rolling on the floor laughing rolling on the floor laughing hate s crashing burning finally
535,rt gabrielrockhill my latest zizek rose fame promoting pomo radlib theory against marxism claiming communism worst catast 
536,rt denooh  only hate mfs motivate them
537,rt derpydrake lets kick off  breeze arkees comes greet you first time but course backfires worst t 
538, hate when be quiet public places or any place people want whole room hear what their phone
539,rt tekmayor mikano children atiku has most experience he was vp obasanjo there was an economic boom blah blah daniel bwa 
540,rt chinnwee hate all soft life luxury life day life high value woman man feminine energy passenger princess healed l 
541,rt chenchenwrites saying love you your friends regular basis really nice hate idea should only be roma 
542,rt togejustvibin jisoo s birthday but her who has gift her dear blinks all income from her channel will be donat 
543,carol had worst luck children 
544,rt starboy today congress made their worst blunder n exposed itself completely former raw chief as dulat joined bharat jodo yatra t 
545,rt babyraikan clearly vid ohm look significant other angry they are fighting I am curious why fans keep saying ohm was tire 
546,rt tribelaw most embarrassing trump was he offered media availability mar lago not single cable news outlet inc 
547, detest celebrity culture though have no desire meet celebrities only famous people I would want meet are dead writers artists ye happens be one living artist connect major level ye 
548,best worst time year your femme friends as we are overwhelmed advertisements heart shaped decor 
549,rt bdtrelilbrother hate vision boards cause why am cutting chanel signs out damn magazine
550,rt mubashshera dev ka toh pata nahi but never make iqbal angry rolling on the floor laughing ok hand light skin tone naumrakiseemaho 
551,rt dawa musa did not undergo any post traumatic therapy or any formal rehabilitation back civil society twitter was my only remedy 
552,rt kthcrave hobiglitters nobody s fault when man was purposely feeding shippers purpose knowing tae was getting hate did 
553,rt smc dc expecting you be polite while there radio silence about guy bench mentioned eastwood s texts married 
554, stardustaligned hate yoowufmandka cannot wait
555, robert chase senior process making rash decision worst made decision quickly call sending player locker room then process how which takes time
556,rt simonharris mbd hi kathryn spotted your letter daily express I am not even angry anymore if you are twitter then please ge 
557,rt peteneville those who not fully understand what up nhs here thread you might help I am consulta 
558,you ez amp  teacher got little angry       
559, emmibear lolakas hate 
560,rt kimguilfoyle joe biden cheers historic year record crime record inflation record illegal immigration record gas prices worst stoc 
561, hate being significant other vulnerable pero cannot help I do not know kung kaya ko pa ba
562,rt wishleeluck really miss when instagram was pictures low key hate all these reels
563, wandereriuvr yeah love silly fishing weapon actually one best picks her cause all my homies hate weapon banner
564,extremely online putin supporters twitter get very sad angry when they are no longer given negative attention their outrageous accusations everyone who shows solidarity ukrainian defense against an illegal military invasion nazi sympathizer sad 
565,rt kumarga all these advancements were propelled by hate misandry when feminists does not need men then we men really nee 
566,rt riviolle because one pointing out feminine features without degrading character while other thinking from thei 
567,rt quenblackwell hate you minimalistic grayscale bitches destruction you cause 
568,rt balltalk teams who could be upset alert tonight kansas virginia new mexico all these top squad teams are road 
569, maxzsz thank you is terrible comment down what you think worst anime all time not get someone s ass over damn header bruh he never even said anything about images 
570,rt seahorse bad shift lotta flu lotta covid lotta pneumonia very sick people long waits offload ambulances no beds no flow 
571, hate territorial bitch be going fr but soon as they heard somebody they know touched you end world like bitch you got whole amman face with tears of joy tired face why we cannot have fun not cock block me cause not tryna be no side nigga
572, antwindmill jkoff mickmazzo kelledin jammingontheone blueselmwood patriot gypsy againmothra magaphoenix digimalice tshadowknow tip ct pismojado blueresin klhu vincegottalotta trumpcrazytrain synyster lordbutters craigcastleber karlton teekeemon angryfleas emerichathome educatingtrump webguytv tommiestephsyup trumplost tastymorsel ultraglamma crogers brulephd mistressredwasp craig thetennpatriot collusiontech billenjoylife section kleeontheright angry mema missledu jonrfleming beastoforem nobusinessyours inugamiz kimmsue hofountains trumpster caperloo earthone face with tears of joy face with tears of joy face with tears of joy cause poor dude giant liar he right group though
573,bruh fuckin hate love bird app 
574,rt unusual whales police car light breaking police car light have released full trading report politicians despite being worst market s 
575,rt bleszmeachuu love hate relationship jae amp woobear hshshshshs 
576,waiting someone s reply worst thing ever woman with white cane light skin tone could not be me clown face 
577, violetvelaryon worst thing they justify themselves by saying they were bad people but they still mock jaeherys fingers or jaehera 
578,rt brexitbuster try very hard avoid using c word social media deeply offensive upsets many people fact sh 
579,rt peteneville those who not fully understand what up nhs here thread you might help I am consulta 
580, wopizza timcast you know what you have  o very angry letter 
581, generalbitch momsliberty porn does not belong public taxpayer funded libraries especially give access minors you want run porn shop open an adult book store get one soros endless ngos fund you are groomer best pedophile worst you picked fight 
582,rt pammy ds have no energy hate anyone seriously have no space my heart carry shit around either love you wish why 
583, vikassng realajay shrishtysays ihrithik pm modi ji desh ke saath hai tum jaise andh bhakt zindagi bhar rote rahoge kabhie emergency pade toh sirf family hi kaam ayegi tumhare not applicable bjp se koi ayega not applicable twitter se koi congress se bhi koi nhi ayega waise tum toh congress ko hate karte bachpana chodo padhai kro 
584, thomasjamesgray want hate but cannot 
585,rt quanetriagenshi I am still thinking hoping we will get quest where haitham will get angry will keep telling kaveh move 
586, isabeloakeshott london should not be deserted streets need full full angry people 
587,rt atptour another adelaide upset popyrin finishes off auger aliassime   score his third career top win adelaidetennis 
588,rt kingpullo  good thing know who your loyal friends are but also very important know who your worst enemy too 
589, hate school but can restrict easy again significant other fine heart suit 
590, maiden many wooers why o x er ie r loften chooses worst 
591, bmaas mixonmania really hate see tie be pushed onto both teams but even more I would hate see bills assigned loss situation or bengals receive win fashion 
592,rt newtannies nwjns hate significant other forced weird they are storytellers like any other idols actors who act represent mess 
593,rt hadithoftheday narrated abu dharr ra  messenger allah peace be upon him said us when one you becomes angry while st 
594, sarahsedigh maybe lot us forget we all have us very powerful can make one love us hate us idol us or even verdamn us how we use power words 
595,rt anime time send off stinkers read find our staff s picks worst anime your choices best 
596,rt chinnwee hate all soft life luxury life day life high value woman man feminine energy passenger princess healed l 
597,rt baujidesi while image khakee already not good often people khakee make worst by their action pnb employee deogarh 
598,oh significant other have many reasons be angry mbc today treating monsta x like they are arent seniors other groups then uploading fancams all members other groups then only uploading ateez 
599,rt neevehoke honestly not understand people dissing itv shows based their budget knowing ours much smaller industry 
600, wusijiex right hate them
601,how one america s best known film critics went from driving delivery truck getting angry phone calls home from sylvester stallone our host carlos frias gets rodriguezrene voice listen or get wlrn sundial your podcast app 
602,rt wayydaminn I am significant other chill laid back like really not be caring why hate when mfs go out their way be weird you don 
603, saranghaeyome thekhabritweets hlo youtube channel j thaker said abdu winning chance zero he only guest am very upset statement 
604, baseballbear will always be cringe watch people be obsessed about possibly worst group people history instead all cool shit happened 
605,rt pammy ds have no energy hate anyone seriously have no space my heart carry shit around either love you wish why 
606, dave odo mr magoo ncdavelife liamkav andrewnutter takethatct ivalkyrie top muppetries jayboy fudyou justdeano mcfunny volpiranyas katieorourke coralblob sc over the top mchaelm hauxton mutzuk fionnmaccool tonybaduy greenboat skepticalmutant carlsmythe mamadeb monstercoyliar markoftec ghoppe crabb vicki doritmi jarbot provaxtexan frankdelia doctorfeelgde i am joli anne jonintn andrewlazarus alaskacryptogi tenebra agoldsmithesq swedishchf clownworld bobo wendy lynnette docstardust justplayingwin dcgreenzone estespga gobantwo stevenmosher zaynjaffer face screaming in fear face screaming in fear face screaming in fear face screaming in fear unbelievable really you are worst 
607, lsrfm global le sserafim im lesserafim hate being european
608,what beautiful music my ears when my aunt calls me sophie warner not by my real name will not say because really hate my real name
609, hate being not good enough mother you hope have chance being good one not mean be as napa ya tuhan aku ini pensive face 
610,rt toritse  worst part about burna concert was not even waiting when people parked outside come out realize 
611,rt unusual whales police car light breaking police car light have released full trading report politicians despite being worst market s 
612, hate fucking dude
613,rt mattxiv people like steven crowder will see fat person tell them they should exercise get healthier then they 
614,rt nightshiftmd I am my sister s bedside we think she contracted covid over weekend she severe respiratory distress 
