,Text
213,rt chinnwee hate all soft life luxury life day life high value woman man feminine energy passenger princess healed l 
214,rt rudegyalv lock all they asses up I am very disgusted
215,rt styxofficial what wrong world people are more upset about football player having health issue than territo 
216,rt starboy today congress made their worst blunder n exposed itself completely former raw chief as dulat joined bharat jodo yatra t 
217,rt kumarga all these advancements were propelled by hate misandry when feminists does not need men then we men really nee 
218,rt stellaparton sad see madam speaker pelosi stepping down as speaker she has been an amazing leader respect her significant other much 
219,rt tracybeanz almost every person posting under my coverage az election cases who angry karilake using court as 
220, bitch never talks about anything happy like hate here 
221,rt unusual whales police car light breaking police car light have released full trading report politicians despite being worst market s 
222,rt ujuanya not shame black women thinking mielle hair oil s future shea moisture s past we are not denying brand their growth 
223,rt scottsaunders when man utd got smashed by brentford manager was two games after taking over an absolute mess squad th 
224,rt no masks at all those who took injection s forget buyers remorse not fight your better judgment stop attacking tho 
225,nigerians are not polite everybody angry woman facepalming 
226, huxijin gt china s worst country every year exports spreads diseases rest world
227, theomnizaddy worst person you know heartbreaking etc
228,rt softmasterkoii elypiloting nerd face nerd face nerd face well acksually nahida supposed be pale because shes based off folklore where she moon 
229, ladybug ronfilipkowski pedo loving was being nice you fucking q nut hate break you you ducking moron entire world sees your type stupid you are fucking embarrassment country you will be wrong side history like other nazis 
230, breft bnes ive tried ive rried everything with avocado salads toast even fuckn pasta yet cant hate them significant other much yucky gross
231, hate you sassy ass niggas
232, rdotchung not unless you hate diaspora 
233,rt blairwaldorfs some cannot accept consumers continue ask pay kn projects kaya they are still being given projects together 
234,rt fukada  white heart red envelope white heart amazon psswitch amazon paypay 
235,quinn played games total bears have worst roster top bottom post era without fields does year s team win single game 
236, dineshdsouza your worst nightmare ass hole
237,rt unusual whales police car light breaking police car light have released full trading report politicians despite being worst market s 
238,rt twxnkk let us play little game start you decide how long stay locked up I will stop count hours eyes like  hours 
239,I am be honest skips tweet was not bad was wrong timing we hate him significant other much we not give af want him gone 
240,rt chartoc well since person already blocked me can give rundown how some leftist radfem really hate half po 
241,rt foivechxn he looks disgusted he defo scrolling twt right now 
242, jackcha zerohedge hundred points all while being one worst contributors emissions 
243,rt lamadre ton heure arrive hanouna toutes tes petites magouilles avec ta petite berdah et papa bollore vont éclatées au grand jour 
244, krishnanrohit I am those guys they are fighting misinfo track mainstream media loves equate  bitcoin hack security system unassailable as matter technology hate idiots who d use drive engagement despite not being cryptobro myself 
245,rt dc draino kevin mccarthy would really hate if verified picture him got around todayhe significant other america first 
246,rt kunikunt scaraarchive because even though he hides behind his angry shield he still incredibly sweet gentle very loving 
247,rt finelinevogue men who hate harry styles are biggest red flags prove me wrong
248,rt samstu not necessarily like nfl commissioner but his worst fear was almost confirmed last night agree him one thi 
249,
250, maiden many wooers t p ie r loften chooses worst  
251,rt unusual whales police car light breaking police car light have released full trading report politicians despite being worst market s 
252, havaianaseurope I have spoken someone already but customer service worst I have ever experienced
253, hate when people ask what wrong but then they not actually care about an answer like why did you ask first place
254,rt mannydain stop getting upset about things you cannot control 
255, reggiebush realskipbayless be fair he did say which suddenly seems significant other irrelevant but guess reading comprehending too hard people or maybe because people want hate skip significant other bad they any blind chance 
256, charlenemarieo onedakinehowlie tgnoble karmaohara drandrewb not feed trolls he only has followers reason man could not even get an elementary sized classroom full kids listen his opinions but he twitter face with tears of joy face with tears of joy loudly crying face loudly crying face rolling on the floor laughing rolling on the floor laughing charlenemarieo would not even bother angry bird tweeter woozy face woozy face loudly crying face loudly crying face 
257, worst feeling world when your hero s pass away ken block pretty much single handedly influenced an entire generation motorsports car enthusiasts did things car we all dream about doing legend forever green heart yellow heart chequered flag 
258,rt babyraikan clearly vid ohm look significant other angry they are fighting I am curious why fans keep saying ohm was tire 
259,he seems upset know am no we qre not going talk like two adults if could wouldnt now be tweeting as last decade my life circles drain sigh 
260,rt dmmovies shehnaazgill gururandhawa s music video moonrise s first poster out however some fans have been left upset 
261,rt sussexdetective can become good reaction meme everytime see angry racist brits my mentions laughing out loud 
262,rt jayruies director try look angryheeseung 
263,im like minecraft diorite you either love me or you hate me
264,rt dc draino kevin mccarthy would really hate if verified picture him got around todayhe significant other america first 
265,rt filmibeat here s why shehnaazgill s fans are upset guru randhawa s new music album shehnaazgiil gururandhawana moonrise ht 
266, gaslyy très bonne décision dis donc hâte d entendre ta douce voix mielleuse smiling face with sunglasses 
267, hate people shitty recommendations like how did me liking ethel cain lead you recommending me camila cabello what was correlation between two 
268,rt feyerabender hate shit man 
269,these niggas be worst studio stop wasting greatness flex 
270,rt starboy today congress made their worst blunder n exposed itself completely former raw chief as dulat joined bharat jodo yatra t 
271,rt kaylan tx worst tweet significant other far congratulations pagnattijrespn 
272, tshadowknow acrytearsmag jkoff mickmazzo kelledin jammingontheone blueselmwood patriot gypsy againmothra magaphoenix digimalice tip ct pismojado blueresin klhu vincegottalotta trumpcrazytrain synyster lordbutters craigcastleber karlton teekeemon angryfleas emerichathome educatingtrump webguytv tommiestephsyup trumplost tastymorsel ultraglamma crogers brulephd mistressredwasp craig thetennpatriot collusiontech billenjoylife section kleeontheright angry mema missledu jonrfleming beastoforem nobusinessyours inugamiz kimmsue hofountains trumpster caperloo earthone he makes up craziest pile of poo 
273,rt baujidesi while image khakee already not good often people khakee make worst by their action pnb employee deogarh 
274,rt rahul forpm rupee becomes worst performing currency asia 
275,rt dylan dream maker confessions will make you hate me  sa totoo lang mas magiging successful yung final line up dito sa 
276, angry staffer will he refuse leave stage rally outside congress 
277, know I am going get angry comments from some most annoying people internet but winning billion dollars lottery better than making billion dollars as some corporate ghoul because you are not exploiting bunch people money
278,rt sheyman sznn transfer worst transfer all time 
279,rt david osland thanks brexit brits can work longest hours europe worst employment rights europe until they rea 
280,rt seavixen hate think how lot would survive state pension less than okay year drivers  week want more 
281,rt missapprop imagine if deer s worst predator was their own males sounds preposterous but reality human women childre 
282, police car light damnit not ken block what hell going  hate here pensive face pensive face pensive face 
283,point of view he feminist who immigrated from country known their misogyny hate feminists amp being safe haven sex offenders date or friend him not sorry but him seeing women as human beings not much turn  bare minimum 
284,rt pridenprcjudice things hate about you 
285,rt gyeoulbbh lee zii jia s draw first three tournaments  pmo r kodai india open r vito im r q yuq 
286,rt pridenprcjudice things hate about you 
287, hate rude dry attitude having ass people
288,kiss me like you love me fuck me like you hate me
289, am disgusted some people social media audacity you all post body pic caption dad bod when you are clearly shape good you being shape but let us not try change what dad bod looks like face with rolling eyes stop 
290,rt itstobiaf I have realized many men not see misogyny as systemic thing they think women are angry about random things 
291, not hit people when I am angry still train when feel lazy list goes  take control your own mind make right call regardless feeling unlimited possibility awaits tate
292, rinnosukeetqw goawaycrackhead chipenguin wileysr emeraldrobinson not get people spew hate call everyone moron then tuck tail delete tweets unreal block plenty people but not delete anything out there said meant time 
293,rt rnjudyflorida hands down president biden inherited worst mess american history zero transition thankful such an e 
294,rt bswirlsi mgtow still matters he has not been held fire enough about  years he sent out message group men who ha 
295,rt millanoire my fucking boss fortnite default danced me after giving me overtime am significant other angry he literally did front 
296,wrong nobody dangerous worst 
297, fauxfauxley calhands danslott johnnydi you being upset about less than second twerking some funny shit
298, get people being upset denji sidelined pt but his character already developed pt now he living life  new people he meets gonna make story interesting significant other let fujimoto cook 
299,rt kingpullo  good thing know who your loyal friends are but also very important know who your worst enemy too 
300,one thing my work laptop gonna die hate dell 
301,please look her heart her love fans not always let her worry about some rumors she only hate all bitches who try hurt her face with symbols on mouth beckysangels
302,rt salice rose I am really proud myself because hold zero hate my heart anyone ever hurt me or done me wrong reali 
303,rt uncletwirl sing paris then paris delivering worst vocal I have ever heard love 
304,rt grammyczone really hate paying dc officials salaries our government who use their power hurt us pisses me off 
305,hate 
306,rt dc draino kevin mccarthy would really hate if verified picture him got around todayhe significant other america first 
307,rt chinnwee hate all soft life luxury life day life high value woman man feminine energy passenger princess healed l 
308,rt rabiasquared one hardest things about losing someone you love facing reality world does not stop grieve 
309,rt ashoswai vajpayee s man kashmir amp former raw chief as dulat former kashmir chief minister farooq abdullah join rahul gandhi s 
310,rt unusual whales police car light breaking police car light have released full trading report politicians despite being worst market s 
311,hate seeing couples my tl
312,rt oromiafinfine worst genocide happening oromia by terrorist amhara fano edf endf amp regional states forces terrori 
313,rt angeliinax who has worst mediaplay 
314,rt justketh wish im guy no matter fuck up things you you will always gonna get more or less support cause world hate women 
315,rt brat princess be pussy free  not let happen you girls hate you they only want make content you thei 
316,rt akashpanditign  reliancejio india s best mobile connecticity provider world s worst jiocare service executives raised po 
317,rt mattxiv people like steven crowder will see fat person tell them they should exercise get healthier then they 
318, rbarbosa twice because ligasure sucks actually does not stop bleeding laughing out loud use reusable bipolar amp refurbished harmonic instead hate residents are taught buzz buzz buzz 
319,rt rathiiyer one my besti did same me after he showed me video was shocked angry but felt good erotic after onl 
320,laughing out loud you hate me bad hope you bitches know ian even started yet face with tears of joy smiling face with hearts 
321,rt armyreportbr police car light perfil hate massivo direcionado todos os membros repetir denúncia de  vezes por conta forma de den 
322,rt chinnwee hate all soft life luxury life day life high value woman man feminine energy passenger princess healed l 
323,rt rudegyalv lock all they asses up I am very disgusted
324,rt styxofficial what wrong world people are more upset about football player having health issue than territo 
325,rt starboy today congress made their worst blunder n exposed itself completely former raw chief as dulat joined bharat jodo yatra t 
326,rt kumarga all these advancements were propelled by hate misandry when feminists does not need men then we men really nee 
327,rt stellaparton sad see madam speaker pelosi stepping down as speaker she has been an amazing leader respect her significant other much 
328,rt tracybeanz almost every person posting under my coverage az election cases who angry karilake using court as 
329, bitch never talks about anything happy like hate here 
330,rt unusual whales police car light breaking police car light have released full trading report politicians despite being worst market s 
331,rt ujuanya not shame black women thinking mielle hair oil s future shea moisture s past we are not denying brand their growth 
332,rt scottsaunders when man utd got smashed by brentford manager was two games after taking over an absolute mess squad th 
333,rt no masks at all those who took injection s forget buyers remorse not fight your better judgment stop attacking tho 
334,nigerians are not polite everybody angry woman facepalming 
335, huxijin gt china s worst country every year exports spreads diseases rest world
336, theomnizaddy worst person you know heartbreaking etc
337,rt softmasterkoii elypiloting nerd face nerd face nerd face well acksually nahida supposed be pale because shes based off folklore where she moon 
338, ladybug ronfilipkowski pedo loving was being nice you fucking q nut hate break you you ducking moron entire world sees your type stupid you are fucking embarrassment country you will be wrong side history like other nazis 
339, breft bnes ive tried ive rried everything with avocado salads toast even fuckn pasta yet cant hate them significant other much yucky gross
340, hate you sassy ass niggas
341, rdotchung not unless you hate diaspora 
342,rt blairwaldorfs some cannot accept consumers continue ask pay kn projects kaya they are still being given projects together 
343,rt fukada  white heart red envelope white heart amazon psswitch amazon paypay 
344,quinn played games total bears have worst roster top bottom post era without fields does year s team win single game 
345, dineshdsouza your worst nightmare ass hole
346,rt unusual whales police car light breaking police car light have released full trading report politicians despite being worst market s 
347,rt twxnkk let us play little game start you decide how long stay locked up I will stop count hours eyes like  hours 
348,I am be honest skips tweet was not bad was wrong timing we hate him significant other much we not give af want him gone 
349,rt chartoc well since person already blocked me can give rundown how some leftist radfem really hate half po 
350,rt foivechxn he looks disgusted he defo scrolling twt right now 
351, jackcha zerohedge hundred points all while being one worst contributors emissions 
352,rt lamadre ton heure arrive hanouna toutes tes petites magouilles avec ta petite berdah et papa bollore vont éclatées au grand jour 
353, krishnanrohit I am those guys they are fighting misinfo track mainstream media loves equate  bitcoin hack security system unassailable as matter technology hate idiots who d use drive engagement despite not being cryptobro myself 
354,rt dc draino kevin mccarthy would really hate if verified picture him got around todayhe significant other america first 
355,rt kunikunt scaraarchive because even though he hides behind his angry shield he still incredibly sweet gentle very loving 
356,rt finelinevogue men who hate harry styles are biggest red flags prove me wrong
357,rt samstu not necessarily like nfl commissioner but his worst fear was almost confirmed last night agree him one thi 
358,
359, maiden many wooers t p ie r loften chooses worst  
360,rt unusual whales police car light breaking police car light have released full trading report politicians despite being worst market s 
361, havaianaseurope I have spoken someone already but customer service worst I have ever experienced
362, hate when people ask what wrong but then they not actually care about an answer like why did you ask first place
363,rt mannydain stop getting upset about things you cannot control 
364, reggiebush realskipbayless be fair he did say which suddenly seems significant other irrelevant but guess reading comprehending too hard people or maybe because people want hate skip significant other bad they any blind chance 
365, charlenemarieo onedakinehowlie tgnoble karmaohara drandrewb not feed trolls he only has followers reason man could not even get an elementary sized classroom full kids listen his opinions but he twitter face with tears of joy face with tears of joy loudly crying face loudly crying face rolling on the floor laughing rolling on the floor laughing charlenemarieo would not even bother angry bird tweeter woozy face woozy face loudly crying face loudly crying face 
366, worst feeling world when your hero s pass away ken block pretty much single handedly influenced an entire generation motorsports car enthusiasts did things car we all dream about doing legend forever green heart yellow heart chequered flag 
367,rt babyraikan clearly vid ohm look significant other angry they are fighting I am curious why fans keep saying ohm was tire 
368,he seems upset know am no we qre not going talk like two adults if could wouldnt now be tweeting as last decade my life circles drain sigh 
369,rt dmmovies shehnaazgill gururandhawa s music video moonrise s first poster out however some fans have been left upset 
370,rt sussexdetective can become good reaction meme everytime see angry racist brits my mentions laughing out loud 
371,rt jayruies director try look angryheeseung 
372,im like minecraft diorite you either love me or you hate me
373,rt dc draino kevin mccarthy would really hate if verified picture him got around todayhe significant other america first 
374,rt filmibeat here s why shehnaazgill s fans are upset guru randhawa s new music album shehnaazgiil gururandhawana moonrise ht 
375, gaslyy très bonne décision dis donc hâte d entendre ta douce voix mielleuse smiling face with sunglasses 
376, hate people shitty recommendations like how did me liking ethel cain lead you recommending me camila cabello what was correlation between two 
377,rt feyerabender hate shit man 
378,these niggas be worst studio stop wasting greatness flex 
379,rt starboy today congress made their worst blunder n exposed itself completely former raw chief as dulat joined bharat jodo yatra t 
380,rt kaylan tx worst tweet significant other far congratulations pagnattijrespn 
381, tshadowknow acrytearsmag jkoff mickmazzo kelledin jammingontheone blueselmwood patriot gypsy againmothra magaphoenix digimalice tip ct pismojado blueresin klhu vincegottalotta trumpcrazytrain synyster lordbutters craigcastleber karlton teekeemon angryfleas emerichathome educatingtrump webguytv tommiestephsyup trumplost tastymorsel ultraglamma crogers brulephd mistressredwasp craig thetennpatriot collusiontech billenjoylife section kleeontheright angry mema missledu jonrfleming beastoforem nobusinessyours inugamiz kimmsue hofountains trumpster caperloo earthone he makes up craziest pile of poo 
382,rt baujidesi while image khakee already not good often people khakee make worst by their action pnb employee deogarh 
383,rt rahul forpm rupee becomes worst performing currency asia 
384,rt dylan dream maker confessions will make you hate me  sa totoo lang mas magiging successful yung final line up dito sa 
385, angry staffer will he refuse leave stage rally outside congress 
386, know I am going get angry comments from some most annoying people internet but winning billion dollars lottery better than making billion dollars as some corporate ghoul because you are not exploiting bunch people money
387,rt sheyman sznn transfer worst transfer all time 
388,rt david osland thanks brexit brits can work longest hours europe worst employment rights europe until they rea 
389,rt seavixen hate think how lot would survive state pension less than okay year drivers  week want more 
390,rt missapprop imagine if deer s worst predator was their own males sounds preposterous but reality human women childre 
391, police car light damnit not ken block what hell going  hate here pensive face pensive face pensive face 
392,point of view he feminist who immigrated from country known their misogyny hate feminists amp being safe haven sex offenders date or friend him not sorry but him seeing women as human beings not much turn  bare minimum 
393,rt pridenprcjudice things hate about you 
394,rt gyeoulbbh lee zii jia s draw first three tournaments  pmo r kodai india open r vito im r q yuq 
395,rt pammy ds have no energy hate anyone seriously have no space my heart carry shit around either love you wish why 
396, dave odo mr magoo ncdavelife liamkav andrewnutter takethatct ivalkyrie top muppetries jayboy fudyou justdeano mcfunny volpiranyas katieorourke coralblob sc over the top mchaelm hauxton mutzuk fionnmaccool tonybaduy greenboat skepticalmutant carlsmythe mamadeb monstercoyliar markoftec ghoppe crabb vicki doritmi jarbot provaxtexan frankdelia doctorfeelgde i am joli anne jonintn andrewlazarus alaskacryptogi tenebra agoldsmithesq swedishchf clownworld bobo wendy lynnette docstardust justplayingwin dcgreenzone estespga gobantwo stevenmosher zaynjaffer face screaming in fear face screaming in fear face screaming in fear face screaming in fear unbelievable really you are worst 
397, lsrfm global le sserafim im lesserafim hate being european
398,what beautiful music my ears when my aunt calls me sophie warner not by my real name will not say because really hate my real name
399, hate being not good enough mother you hope have chance being good one not mean be as napa ya tuhan aku ini pensive face 
400,rt toritse  worst part about burna concert was not even waiting when people parked outside come out realize 
401,rt unusual whales police car light breaking police car light have released full trading report politicians despite being worst market s 
402, hate fucking dude
403,rt mattxiv people like steven crowder will see fat person tell them they should exercise get healthier then they 
404,rt nightshiftmd I am my sister s bedside we think she contracted covid over weekend she severe respiratory distress 
405, os somkheleomkhulu hate him face with tears of joy face with tears of joy face with tears of joy face with tears of joy 
406,rt theholisticpsyc having partner who grew up home adults who could not self regulate can be difficult people from these homes 
407,rt pammy ds have no energy hate anyone seriously have no space my heart carry shit around either love you wish why 
408,
409, cannot believe bitch really moved halfway across country continue stalking me sending me anonymous hate mail tumblr get fucking life
410,I have recently started doing thing where every time want argue twitter write my angry reply then exit out app before posting truly best thing I have done my mental health since wellbutrin 
411,rt pierrefleury worst lie we have told men specifically once they find person they are meant be they are going t 
412,rt main valkyrie  time eliminate once all cancerous parasite gaming communityhis hate speech continuous hara 
413,rt mohataul maulana haq nawaz jhangvi had boldly publicized these sentiments declared shia be worst brand kuffar 
414,rt shaksingh ani hate against narendra modi has become hate against india by way malda place where most number bangaldeshi 
415, visegrad kyrgyzstan upset but kyrgyzstan does not even teach their own kyrgyzs language their own kyrgyzstan schools 
416,rt chinnwee hate all soft life luxury life day life high value woman man feminine energy passenger princess healed l 
417, lolly hate hoes cardiac arrest his heart stopped know force can cause but video not look like too much force from higgins significant other I am wondering something they bout find 
418,rt chinnwee hate all soft life luxury life day life high value woman man feminine energy passenger princess healed l 
419,rt jeongjoahn growing deeper means absorbing your pain ok going be all okay if they not worst thing you can 
420,rt islandyke had miss my shift friday due health complications had low blood sugar could not properly take food becau 
421, worst way miss someone with o x  r lbe 
