,Text
615, os somkheleomkhulu hate him face with tears of joy face with tears of joy face with tears of joy face with tears of joy 
616,rt theholisticpsyc having partner who grew up home adults who could not self regulate can be difficult people from these homes 
617,rt pammy ds have no energy hate anyone seriously have no space my heart carry shit around either love you wish why 
618,
619, cannot believe bitch really moved halfway across country continue stalking me sending me anonymous hate mail tumblr get fucking life
620,I have recently started doing thing where every time want argue twitter write my angry reply then exit out app before posting truly best thing I have done my mental health since wellbutrin 
621,rt pierrefleury worst lie we have told men specifically once they find person they are meant be they are going t 
622,rt main valkyrie  time eliminate once all cancerous parasite gaming communityhis hate speech continuous hara 
623,rt mohataul maulana haq nawaz jhangvi had boldly publicized these sentiments declared shia be worst brand kuffar 
624,rt shaksingh ani hate against narendra modi has become hate against india by way malda place where most number bangaldeshi 
625, visegrad kyrgyzstan upset but kyrgyzstan does not even teach their own kyrgyzs language their own kyrgyzstan schools 
626,rt chinnwee hate all soft life luxury life day life high value woman man feminine energy passenger princess healed l 
627, lolly hate hoes cardiac arrest his heart stopped know force can cause but video not look like too much force from higgins significant other I am wondering something they bout find 
628,rt chinnwee hate all soft life luxury life day life high value woman man feminine energy passenger princess healed l 
629,rt jeongjoahn growing deeper means absorbing your pain ok going be all okay if they not worst thing you can 
630,rt islandyke had miss my shift friday due health complications had low blood sugar could not properly take food becau 
631, worst way miss someone with o x  r lbe 
632,rt novieverest anytime kenneth okonkwo goes air pdapc group he always leaves them angry end they finished politics 
633, mzanona atrupar rolling on the floor laughing rolling on the floor laughing rolling on the floor laughing rolling on the floor laughing rolling on the floor laughing rolling on the floor laughing rolling on the floor laughing rolling on the floor laughing rolling on the floor laughing rolling on the floor laughing hate s crashing burning finally
634,rt gabrielrockhill my latest zizek rose fame promoting pomo radlib theory against marxism claiming communism worst catast 
635,rt denooh  only hate mfs motivate them
636,rt derpydrake lets kick off  breeze arkees comes greet you first time but course backfires worst t 
637, hate when be quiet public places or any place people want whole room hear what their phone
638,rt tekmayor mikano children atiku has most experience he was vp obasanjo there was an economic boom blah blah daniel bwa 
639,rt chinnwee hate all soft life luxury life day life high value woman man feminine energy passenger princess healed l 
640,rt chenchenwrites saying love you your friends regular basis really nice hate idea should only be roma 
641,rt togejustvibin jisoo s birthday but her who has gift her dear blinks all income from her channel will be donat 
642,carol had worst luck children 
643,rt starboy today congress made their worst blunder n exposed itself completely former raw chief as dulat joined bharat jodo yatra t 
644,rt babyraikan clearly vid ohm look significant other angry they are fighting I am curious why fans keep saying ohm was tire 
645,rt tribelaw most embarrassing trump was he offered media availability mar lago not single cable news outlet inc 
646, detest celebrity culture though have no desire meet celebrities only famous people I would want meet are dead writers artists ye happens be one living artist connect major level ye 
647,best worst time year your femme friends as we are overwhelmed advertisements heart shaped decor 
648,rt bdtrelilbrother hate vision boards cause why am cutting chanel signs out damn magazine
649,rt mubashshera dev ka toh pata nahi but never make iqbal angry rolling on the floor laughing ok hand light skin tone naumrakiseemaho 
650,rt dawa musa did not undergo any post traumatic therapy or any formal rehabilitation back civil society twitter was my only remedy 
651,rt kthcrave hobiglitters nobody s fault when man was purposely feeding shippers purpose knowing tae was getting hate did 
652,rt smc dc expecting you be polite while there radio silence about guy bench mentioned eastwood s texts married 
653, stardustaligned hate yoowufmandka cannot wait
654, robert chase senior process making rash decision worst made decision quickly call sending player locker room then process how which takes time
655,rt simonharris mbd hi kathryn spotted your letter daily express I am not even angry anymore if you are twitter then please ge 
656,rt peteneville those who not fully understand what up nhs here thread you might help I am consulta 
657,you ez amp  teacher got little angry       
658, emmibear lolakas hate 
659,rt kimguilfoyle joe biden cheers historic year record crime record inflation record illegal immigration record gas prices worst stoc 
660, hate being significant other vulnerable pero cannot help I do not know kung kaya ko pa ba
661,rt wishleeluck really miss when instagram was pictures low key hate all these reels
662, wandereriuvr yeah love silly fishing weapon actually one best picks her cause all my homies hate weapon banner
663,extremely online putin supporters twitter get very sad angry when they are no longer given negative attention their outrageous accusations everyone who shows solidarity ukrainian defense against an illegal military invasion nazi sympathizer sad 
664,rt kumarga all these advancements were propelled by hate misandry when feminists does not need men then we men really nee 
665,rt riviolle because one pointing out feminine features without degrading character while other thinking from thei 
666,rt quenblackwell hate you minimalistic grayscale bitches destruction you cause 
667,rt balltalk teams who could be upset alert tonight kansas virginia new mexico all these top squad teams are road 
668, maxzsz thank you is terrible comment down what you think worst anime all time not get someone s ass over damn header bruh he never even said anything about images 
669,rt seahorse bad shift lotta flu lotta covid lotta pneumonia very sick people long waits offload ambulances no beds no flow 
670, hate territorial bitch be going fr but soon as they heard somebody they know touched you end world like bitch you got whole amman face with tears of joy tired face why we cannot have fun not cock block me cause not tryna be no side nigga
671, antwindmill jkoff mickmazzo kelledin jammingontheone blueselmwood patriot gypsy againmothra magaphoenix digimalice tshadowknow tip ct pismojado blueresin klhu vincegottalotta trumpcrazytrain synyster lordbutters craigcastleber karlton teekeemon angryfleas emerichathome educatingtrump webguytv tommiestephsyup trumplost tastymorsel ultraglamma crogers brulephd mistressredwasp craig thetennpatriot collusiontech billenjoylife section kleeontheright angry mema missledu jonrfleming beastoforem nobusinessyours inugamiz kimmsue hofountains trumpster caperloo earthone face with tears of joy face with tears of joy face with tears of joy cause poor dude giant liar he right group though
672,bruh fuckin hate love bird app 
673,rt unusual whales police car light breaking police car light have released full trading report politicians despite being worst market s 
674,rt bleszmeachuu love hate relationship jae amp woobear hshshshshs 
675,waiting someone s reply worst thing ever woman with white cane light skin tone could not be me clown face 
676, violetvelaryon worst thing they justify themselves by saying they were bad people but they still mock jaeherys fingers or jaehera 
677,rt brexitbuster try very hard avoid using c word social media deeply offensive upsets many people fact sh 
678,rt peteneville those who not fully understand what up nhs here thread you might help I am consulta 
679, wopizza timcast you know what you have  o very angry letter 
680, generalbitch momsliberty porn does not belong public taxpayer funded libraries especially give access minors you want run porn shop open an adult book store get one soros endless ngos fund you are groomer best pedophile worst you picked fight 
681,rt pammy ds have no energy hate anyone seriously have no space my heart carry shit around either love you wish why 
682, vikassng realajay shrishtysays ihrithik pm modi ji desh ke saath hai tum jaise andh bhakt zindagi bhar rote rahoge kabhie emergency pade toh sirf family hi kaam ayegi tumhare not applicable bjp se koi ayega not applicable twitter se koi congress se bhi koi nhi ayega waise tum toh congress ko hate karte bachpana chodo padhai kro 
683, thomasjamesgray want hate but cannot 
684,rt quanetriagenshi I am still thinking hoping we will get quest where haitham will get angry will keep telling kaveh move 
685, isabeloakeshott london should not be deserted streets need full full angry people 
686,rt atptour another adelaide upset popyrin finishes off auger aliassime   score his third career top win adelaidetennis 
687,rt kingpullo  good thing know who your loyal friends are but also very important know who your worst enemy too 
688, hate school but can restrict easy again significant other fine heart suit 
689, maiden many wooers why o x er ie r loften chooses worst 
690, bmaas mixonmania really hate see tie be pushed onto both teams but even more I would hate see bills assigned loss situation or bengals receive win fashion 
691,rt shootariff hate mayor bowser creating these lane streets throughout city unamused face 
692,rt dbongino today january rd joe biden worst president us history 
693, nycbeastdrking marvelmorlocks they both love running under ground clandestine hate groups he has not been scene long time since his death he has history being problem child all fits his typical pathos against mutants subverting narrative
694, avinash vishnucinemas suntv actorvijay worst response vishnucinemas persevering face face with steam from nose 
695,rt barryonhere donovan mitchell picked absolute worst night have one best games nba history 
696, nilegardiner she did huge damage country running down state owned assets then selling them off cheap service confidence trick low taxation worst all damaging housing market ever by selling council stock off below market value without plan replienish 
697, you think you are good side you are an empathetic amp kind person smiling face with halo you wonder why those bad side are irrational amp simply full hate smiling face with horns you might be applying fundamental attribution error  common perceptual bias 
698,egoic neurosis back burner during writing will can should but how no time am lonely am living am failure am amazing am worst not mistake content see around pat head amp get with brief moments you have
699, constipatedpurr her music tops charts because she better they hate her bcos she white skull 
700,rt tradersparadise you can see stagflation trade wall street starting build into prepping worst as gld still cli 
701, lublinereric no would not rolling on the floor laughing not know why you all say shit like loudly crying face would be same people wanting cancelled today as yesterday reality coupled historical context are terrible right wing they hate 
702,rt njpwglobal don will tomorrow you are ring god professional wrestling apologies karl gotch but who 
703, hate these straightedgers face with tears of joy 
704,rt newtannies nwjns hate significant other forced weird they are storytellers like any other idols actors who act represent mess 
705,rt hadithoftheday narrated abu dharr ra  messenger allah peace be upon him said us when one you becomes angry while st 
706, sarahsedigh maybe lot us forget we all have us very powerful can make one love us hate us idol us or even verdamn us how we use power words 
707,rt anime time send off stinkers read find our staff s picks worst anime your choices best 
708,rt chinnwee hate all soft life luxury life day life high value woman man feminine energy passenger princess healed l 
709,rt baujidesi while image khakee already not good often people khakee make worst by their action pnb employee deogarh 
710,oh significant other have many reasons be angry mbc today treating monsta x like they are arent seniors other groups then uploading fancams all members other groups then only uploading ateez 
711,rt neevehoke honestly not understand people dissing itv shows based their budget knowing ours much smaller industry 
712, wusijiex right hate them
713,how one america s best known film critics went from driving delivery truck getting angry phone calls home from sylvester stallone our host carlos frias gets rodriguezrene voice listen or get wlrn sundial your podcast app 
714,rt wayydaminn I am significant other chill laid back like really not be caring why hate when mfs go out their way be weird you don 
715, saranghaeyome thekhabritweets hlo youtube channel j thaker said abdu winning chance zero he only guest am very upset statement 
716, baseballbear will always be cringe watch people be obsessed about possibly worst group people history instead all cool shit happened 
717,rt pammy ds have no energy hate anyone seriously have no space my heart carry shit around either love you wish why 
718, dave odo mr magoo ncdavelife liamkav andrewnutter takethatct ivalkyrie top muppetries jayboy fudyou justdeano mcfunny volpiranyas katieorourke coralblob sc over the top mchaelm hauxton mutzuk fionnmaccool tonybaduy greenboat skepticalmutant carlsmythe mamadeb monstercoyliar markoftec ghoppe crabb vicki doritmi jarbot provaxtexan frankdelia doctorfeelgde i am joli anne jonintn andrewlazarus alaskacryptogi tenebra agoldsmithesq swedishchf clownworld bobo wendy lynnette docstardust justplayingwin dcgreenzone estespga gobantwo stevenmosher zaynjaffer face screaming in fear face screaming in fear face screaming in fear face screaming in fear unbelievable really you are worst 
719, lsrfm global le sserafim im lesserafim hate being european
720,what beautiful music my ears when my aunt calls me sophie warner not by my real name will not say because really hate my real name
721, hate being not good enough mother you hope have chance being good one not mean be as napa ya tuhan aku ini pensive face 
722,rt toritse  worst part about burna concert was not even waiting when people parked outside come out realize 
723,rt unusual whales police car light breaking police car light have released full trading report politicians despite being worst market s 
724, hate fucking dude
725,rt mattxiv people like steven crowder will see fat person tell them they should exercise get healthier then they 
726,rt nightshiftmd I am my sister s bedside we think she contracted covid over weekend she severe respiratory distress 
727, os somkheleomkhulu hate him face with tears of joy face with tears of joy face with tears of joy face with tears of joy 
728,rt theholisticpsyc having partner who grew up home adults who could not self regulate can be difficult people from these homes 
729,rt pammy ds have no energy hate anyone seriously have no space my heart carry shit around either love you wish why 
730,
731, cannot believe bitch really moved halfway across country continue stalking me sending me anonymous hate mail tumblr get fucking life
732,I have recently started doing thing where every time want argue twitter write my angry reply then exit out app before posting truly best thing I have done my mental health since wellbutrin 
733,rt pierrefleury worst lie we have told men specifically once they find person they are meant be they are going t 
734,rt main valkyrie  time eliminate once all cancerous parasite gaming communityhis hate speech continuous hara 
735,rt mohataul maulana haq nawaz jhangvi had boldly publicized these sentiments declared shia be worst brand kuffar 
736,rt shaksingh ani hate against narendra modi has become hate against india by way malda place where most number bangaldeshi 
737, visegrad kyrgyzstan upset but kyrgyzstan does not even teach their own kyrgyzs language their own kyrgyzstan schools 
738,rt chinnwee hate all soft life luxury life day life high value woman man feminine energy passenger princess healed l 
739, lolly hate hoes cardiac arrest his heart stopped know force can cause but video not look like too much force from higgins significant other I am wondering something they bout find 
740,rt chinnwee hate all soft life luxury life day life high value woman man feminine energy passenger princess healed l 
741,rt jeongjoahn growing deeper means absorbing your pain ok going be all okay if they not worst thing you can 
742,rt islandyke had miss my shift friday due health complications had low blood sugar could not properly take food becau 
743, worst way miss someone with o x  r lbe 
744,rt novieverest anytime kenneth okonkwo goes air pdapc group he always leaves them angry end they finished politics 
745, mzanona atrupar rolling on the floor laughing rolling on the floor laughing rolling on the floor laughing rolling on the floor laughing rolling on the floor laughing rolling on the floor laughing rolling on the floor laughing rolling on the floor laughing rolling on the floor laughing rolling on the floor laughing hate s crashing burning finally
746,rt gabrielrockhill my latest zizek rose fame promoting pomo radlib theory against marxism claiming communism worst catast 
747,rt denooh  only hate mfs motivate them
748,rt derpydrake lets kick off  breeze arkees comes greet you first time but course backfires worst t 
749, hate when be quiet public places or any place people want whole room hear what their phone
750,rt tekmayor mikano children atiku has most experience he was vp obasanjo there was an economic boom blah blah daniel bwa 
751,rt chinnwee hate all soft life luxury life day life high value woman man feminine energy passenger princess healed l 
752,rt chenchenwrites saying love you your friends regular basis really nice hate idea should only be roma 
753,rt togejustvibin jisoo s birthday but her who has gift her dear blinks all income from her channel will be donat 
754,carol had worst luck children 
755,rt starboy today congress made their worst blunder n exposed itself completely former raw chief as dulat joined bharat jodo yatra t 
756,rt babyraikan clearly vid ohm look significant other angry they are fighting I am curious why fans keep saying ohm was tire 
757,rt tribelaw most embarrassing trump was he offered media availability mar lago not single cable news outlet inc 
758, detest celebrity culture though have no desire meet celebrities only famous people I would want meet are dead writers artists ye happens be one living artist connect major level ye 
759,best worst time year your femme friends as we are overwhelmed advertisements heart shaped decor 
760,rt bdtrelilbrother hate vision boards cause why am cutting chanel signs out damn magazine
761,rt mubashshera dev ka toh pata nahi but never make iqbal angry rolling on the floor laughing ok hand light skin tone naumrakiseemaho 
762,rt dawa musa did not undergo any post traumatic therapy or any formal rehabilitation back civil society twitter was my only remedy 
763,rt kthcrave hobiglitters nobody s fault when man was purposely feeding shippers purpose knowing tae was getting hate did 
764,rt smc dc expecting you be polite while there radio silence about guy bench mentioned eastwood s texts married 
765, stardustaligned hate yoowufmandka cannot wait
766, robert chase senior process making rash decision worst made decision quickly call sending player locker room then process how which takes time
767,rt simonharris mbd hi kathryn spotted your letter daily express I am not even angry anymore if you are twitter then please ge 
768,rt peteneville those who not fully understand what up nhs here thread you might help I am consulta 
769,you ez amp  teacher got little angry       
770, emmibear lolakas hate 
771,rt kimguilfoyle joe biden cheers historic year record crime record inflation record illegal immigration record gas prices worst stoc 
772, hate being significant other vulnerable pero cannot help I do not know kung kaya ko pa ba
773,rt wishleeluck really miss when instagram was pictures low key hate all these reels
774, wandereriuvr yeah love silly fishing weapon actually one best picks her cause all my homies hate weapon banner
775,extremely online putin supporters twitter get very sad angry when they are no longer given negative attention their outrageous accusations everyone who shows solidarity ukrainian defense against an illegal military invasion nazi sympathizer sad 
776,rt kumarga all these advancements were propelled by hate misandry when feminists does not need men then we men really nee 
777,rt riviolle because one pointing out feminine features without degrading character while other thinking from thei 
778,rt quenblackwell hate you minimalistic grayscale bitches destruction you cause 
779,rt balltalk teams who could be upset alert tonight kansas virginia new mexico all these top squad teams are road 
780, maxzsz thank you is terrible comment down what you think worst anime all time not get someone s ass over damn header bruh he never even said anything about images 
781,rt seahorse bad shift lotta flu lotta covid lotta pneumonia very sick people long waits offload ambulances no beds no flow 
782, hate territorial bitch be going fr but soon as they heard somebody they know touched you end world like bitch you got whole amman face with tears of joy tired face why we cannot have fun not cock block me cause not tryna be no side nigga
783, antwindmill jkoff mickmazzo kelledin jammingontheone blueselmwood patriot gypsy againmothra magaphoenix digimalice tshadowknow tip ct pismojado blueresin klhu vincegottalotta trumpcrazytrain synyster lordbutters craigcastleber karlton teekeemon angryfleas emerichathome educatingtrump webguytv tommiestephsyup trumplost tastymorsel ultraglamma crogers brulephd mistressredwasp craig thetennpatriot collusiontech billenjoylife section kleeontheright angry mema missledu jonrfleming beastoforem nobusinessyours inugamiz kimmsue hofountains trumpster caperloo earthone face with tears of joy face with tears of joy face with tears of joy cause poor dude giant liar he right group though
784,bruh fuckin hate love bird app 
785,rt unusual whales police car light breaking police car light have released full trading report politicians despite being worst market s 
786,rt bleszmeachuu love hate relationship jae amp woobear hshshshshs 
787,waiting someone s reply worst thing ever woman with white cane light skin tone could not be me clown face 
788, violetvelaryon worst thing they justify themselves by saying they were bad people but they still mock jaeherys fingers or jaehera 
789,rt brexitbuster try very hard avoid using c word social media deeply offensive upsets many people fact sh 
