,Text
0, rbarbosa twice because ligasure sucks actually does not stop bleeding laughing out loud use reusable bipolar amp refurbished harmonic instead hate residents are taught buzz buzz buzz 
1,rt rathiiyer one my besti did same me after he showed me video was shocked angry but felt good erotic after onl 
2,laughing out loud you hate me bad hope you bitches know ian even started yet face with tears of joy smiling face with hearts 
3,rt armyreportbr police car light perfil hate massivo direcionado todos os membros repetir denúncia de  vezes por conta forma de den 
4,rt chinnwee hate all soft life luxury life day life high value woman man feminine energy passenger princess healed l 
5,rt rudegyalv lock all they asses up I am very disgusted
6,rt styxofficial what wrong world people are more upset about football player having health issue than territo 
7,rt starboy today congress made their worst blunder n exposed itself completely former raw chief as dulat joined bharat jodo yatra t 
8,rt kumarga all these advancements were propelled by hate misandry when feminists does not need men then we men really nee 
9,rt stellaparton sad see madam speaker pelosi stepping down as speaker she has been an amazing leader respect her significant other much 
10,rt tracybeanz almost every person posting under my coverage az election cases who angry karilake using court as 
11, bitch never talks about anything happy like hate here 
12,rt unusual whales police car light breaking police car light have released full trading report politicians despite being worst market s 
13,rt ujuanya not shame black women thinking mielle hair oil s future shea moisture s past we are not denying brand their growth 
14,rt scottsaunders when man utd got smashed by brentford manager was two games after taking over an absolute mess squad th 
15,rt no masks at all those who took injection s forget buyers remorse not fight your better judgment stop attacking tho 
16,nigerians are not polite everybody angry woman facepalming 
17, huxijin gt china s worst country every year exports spreads diseases rest world
18, theomnizaddy worst person you know heartbreaking etc
19,rt softmasterkoii elypiloting nerd face nerd face nerd face well acksually nahida supposed be pale because shes based off folklore where she moon 
20, ladybug ronfilipkowski pedo loving was being nice you fucking q nut hate break you you ducking moron entire world sees your type stupid you are fucking embarrassment country you will be wrong side history like other nazis 
21, breft bnes ive tried ive rried everything with avocado salads toast even fuckn pasta yet cant hate them significant other much yucky gross
22, hate you sassy ass niggas
23, rdotchung not unless you hate diaspora 
24,rt blairwaldorfs some cannot accept consumers continue ask pay kn projects kaya they are still being given projects together 
25,rt fukada  white heart red envelope white heart amazon psswitch amazon paypay 
26,quinn played games total bears have worst roster top bottom post era without fields does year s team win single game 
27, dineshdsouza your worst nightmare ass hole
28,rt unusual whales police car light breaking police car light have released full trading report politicians despite being worst market s 
29,rt twxnkk let us play little game start you decide how long stay locked up I will stop count hours eyes like  hours 
30,I am be honest skips tweet was not bad was wrong timing we hate him significant other much we not give af want him gone 
31,rt chartoc well since person already blocked me can give rundown how some leftist radfem really hate half po 
32,rt foivechxn he looks disgusted he defo scrolling twt right now 
33, jackcha zerohedge hundred points all while being one worst contributors emissions 
34,rt lamadre ton heure arrive hanouna toutes tes petites magouilles avec ta petite berdah et papa bollore vont éclatées au grand jour 
35, krishnanrohit I am those guys they are fighting misinfo track mainstream media loves equate  bitcoin hack security system unassailable as matter technology hate idiots who d use drive engagement despite not being cryptobro myself 
36,rt dc draino kevin mccarthy would really hate if verified picture him got around todayhe significant other america first 
37,rt kunikunt scaraarchive because even though he hides behind his angry shield he still incredibly sweet gentle very loving 
38,rt finelinevogue men who hate harry styles are biggest red flags prove me wrong
39,rt samstu not necessarily like nfl commissioner but his worst fear was almost confirmed last night agree him one thi 
40,
41, maiden many wooers t p ie r loften chooses worst  
42,rt unusual whales police car light breaking police car light have released full trading report politicians despite being worst market s 
43, havaianaseurope I have spoken someone already but customer service worst I have ever experienced
44, hate when people ask what wrong but then they not actually care about an answer like why did you ask first place
45,rt mannydain stop getting upset about things you cannot control 
46, reggiebush realskipbayless be fair he did say which suddenly seems significant other irrelevant but guess reading comprehending too hard people or maybe because people want hate skip significant other bad they any blind chance 
47, charlenemarieo onedakinehowlie tgnoble karmaohara drandrewb not feed trolls he only has followers reason man could not even get an elementary sized classroom full kids listen his opinions but he twitter face with tears of joy face with tears of joy loudly crying face loudly crying face rolling on the floor laughing rolling on the floor laughing charlenemarieo would not even bother angry bird tweeter woozy face woozy face loudly crying face loudly crying face 
48, worst feeling world when your hero s pass away ken block pretty much single handedly influenced an entire generation motorsports car enthusiasts did things car we all dream about doing legend forever green heart yellow heart chequered flag 
49,rt babyraikan clearly vid ohm look significant other angry they are fighting I am curious why fans keep saying ohm was tire 
50,he seems upset know am no we qre not going talk like two adults if could wouldnt now be tweeting as last decade my life circles drain sigh 
51,rt dmmovies shehnaazgill gururandhawa s music video moonrise s first poster out however some fans have been left upset 
52,rt sussexdetective can become good reaction meme everytime see angry racist brits my mentions laughing out loud 
53,rt jayruies director try look angryheeseung 
54,im like minecraft diorite you either love me or you hate me
55,rt dc draino kevin mccarthy would really hate if verified picture him got around todayhe significant other america first 
56,rt filmibeat here s why shehnaazgill s fans are upset guru randhawa s new music album shehnaazgiil gururandhawana moonrise ht 
57, gaslyy très bonne décision dis donc hâte d entendre ta douce voix mielleuse smiling face with sunglasses 
58, hate people shitty recommendations like how did me liking ethel cain lead you recommending me camila cabello what was correlation between two 
59,rt feyerabender hate shit man 
60,these niggas be worst studio stop wasting greatness flex 
61,rt starboy today congress made their worst blunder n exposed itself completely former raw chief as dulat joined bharat jodo yatra t 
62,rt kaylan tx worst tweet significant other far congratulations pagnattijrespn 
63, tshadowknow acrytearsmag jkoff mickmazzo kelledin jammingontheone blueselmwood patriot gypsy againmothra magaphoenix digimalice tip ct pismojado blueresin klhu vincegottalotta trumpcrazytrain synyster lordbutters craigcastleber karlton teekeemon angryfleas emerichathome educatingtrump webguytv tommiestephsyup trumplost tastymorsel ultraglamma crogers brulephd mistressredwasp craig thetennpatriot collusiontech billenjoylife section kleeontheright angry mema missledu jonrfleming beastoforem nobusinessyours inugamiz kimmsue hofountains trumpster caperloo earthone he makes up craziest pile of poo 
64,rt baujidesi while image khakee already not good often people khakee make worst by their action pnb employee deogarh 
65,rt rahul forpm rupee becomes worst performing currency asia 
66,rt dylan dream maker confessions will make you hate me  sa totoo lang mas magiging successful yung final line up dito sa 
67, angry staffer will he refuse leave stage rally outside congress 
68, know I am going get angry comments from some most annoying people internet but winning billion dollars lottery better than making billion dollars as some corporate ghoul because you are not exploiting bunch people money
69,rt sheyman sznn transfer worst transfer all time 
70,rt david osland thanks brexit brits can work longest hours europe worst employment rights europe until they rea 
71,rt seavixen hate think how lot would survive state pension less than okay year drivers  week want more 
72,rt missapprop imagine if deer s worst predator was their own males sounds preposterous but reality human women childre 
73, police car light damnit not ken block what hell going  hate here pensive face pensive face pensive face 
74,point of view he feminist who immigrated from country known their misogyny hate feminists amp being safe haven sex offenders date or friend him not sorry but him seeing women as human beings not much turn  bare minimum 
75,rt pridenprcjudice things hate about you 
76,rt gyeoulbbh lee zii jia s draw first three tournaments  pmo r kodai india open r vito im r q yuq 
77,rt pridenprcjudice things hate about you 
78, hate rude dry attitude having ass people
79,kiss me like you love me fuck me like you hate me
80, am disgusted some people social media audacity you all post body pic caption dad bod when you are clearly shape good you being shape but let us not try change what dad bod looks like face with rolling eyes stop 
81,rt itstobiaf I have realized many men not see misogyny as systemic thing they think women are angry about random things 
82, not hit people when I am angry still train when feel lazy list goes  take control your own mind make right call regardless feeling unlimited possibility awaits tate
83, rinnosukeetqw goawaycrackhead chipenguin wileysr emeraldrobinson not get people spew hate call everyone moron then tuck tail delete tweets unreal block plenty people but not delete anything out there said meant time 
84,rt rnjudyflorida hands down president biden inherited worst mess american history zero transition thankful such an e 
85,rt bswirlsi mgtow still matters he has not been held fire enough about  years he sent out message group men who ha 
86,rt millanoire my fucking boss fortnite default danced me after giving me overtime am significant other angry he literally did front 
87, nick okay littlered x guess we all hate being old but nothing we can about hate or not must accept 
88, hate when I am right but son bitch I am really pissed 
89,rt gyarufem man making fun completely fine art made by white feminists getting upset people complimenting th 
90, hate deleted app cause now see those damn view counts
91,rt kartewnboi people site go out their way hate like anything like how you wake up mad about 
92,sometimes hate when people talk me hundred points sleeping face 
93,rt ghazal bux yrkkh writing not best but its not worstall you have pay v close attention what story makers t 
94,wrong nobody dangerous worst 
95,also if your profile says you only rt men hate women etc you are getting blocked am not man am not interested your misogyny 
96,rt andy sidecake fucking hate when mario gets burned starts hopping jumping around like can you fucking grow up focus th 
97,rt pridenprcjudice things hate about you 
98,rt dc draino kevin mccarthy would really hate if verified picture him got around todayhe significant other america first 
99,rt chinnwee hate all soft life luxury life day life high value woman man feminine energy passenger princess healed l 
100,rt rabiasquared one hardest things about losing someone you love facing reality world does not stop grieve 
101,rt ashoswai vajpayee s man kashmir amp former raw chief as dulat former kashmir chief minister farooq abdullah join rahul gandhi s 
102,rt unusual whales police car light breaking police car light have released full trading report politicians despite being worst market s 
103,hate seeing couples my tl
104,rt oromiafinfine worst genocide happening oromia by terrorist amhara fano edf endf amp regional states forces terrori 
105,rt angeliinax who has worst mediaplay 
106,rt justketh wish im guy no matter fuck up things you you will always gonna get more or less support cause world hate women 
107,rt brat princess be pussy free  not let happen you girls hate you they only want make content you thei 
108,rt akashpanditign  reliancejio india s best mobile connecticity provider world s worst jiocare service executives raised po 
109,rt mattxiv people like steven crowder will see fat person tell them they should exercise get healthier then they 
110, rbarbosa twice because ligasure sucks actually does not stop bleeding laughing out loud use reusable bipolar amp refurbished harmonic instead hate residents are taught buzz buzz buzz 
111,rt rathiiyer one my besti did same me after he showed me video was shocked angry but felt good erotic after onl 
112,laughing out loud you hate me bad hope you bitches know ian even started yet face with tears of joy smiling face with hearts 
113,rt armyreportbr police car light perfil hate massivo direcionado todos os membros repetir denúncia de  vezes por conta forma de den 
114,rt chinnwee hate all soft life luxury life day life high value woman man feminine energy passenger princess healed l 
115,rt rudegyalv lock all they asses up I am very disgusted
116,rt styxofficial what wrong world people are more upset about football player having health issue than territo 
117,rt starboy today congress made their worst blunder n exposed itself completely former raw chief as dulat joined bharat jodo yatra t 
118,rt kumarga all these advancements were propelled by hate misandry when feminists does not need men then we men really nee 
119,rt stellaparton sad see madam speaker pelosi stepping down as speaker she has been an amazing leader respect her significant other much 
120,rt tracybeanz almost every person posting under my coverage az election cases who angry karilake using court as 
121, bitch never talks about anything happy like hate here 
122,rt unusual whales police car light breaking police car light have released full trading report politicians despite being worst market s 
123,rt ujuanya not shame black women thinking mielle hair oil s future shea moisture s past we are not denying brand their growth 
124,rt scottsaunders when man utd got smashed by brentford manager was two games after taking over an absolute mess squad th 
125,rt no masks at all those who took injection s forget buyers remorse not fight your better judgment stop attacking tho 
126,nigerians are not polite everybody angry woman facepalming 
127, huxijin gt china s worst country every year exports spreads diseases rest world
128, theomnizaddy worst person you know heartbreaking etc
129,rt softmasterkoii elypiloting nerd face nerd face nerd face well acksually nahida supposed be pale because shes based off folklore where she moon 
130, ladybug ronfilipkowski pedo loving was being nice you fucking q nut hate break you you ducking moron entire world sees your type stupid you are fucking embarrassment country you will be wrong side history like other nazis 
131, breft bnes ive tried ive rried everything with avocado salads toast even fuckn pasta yet cant hate them significant other much yucky gross
132, hate you sassy ass niggas
133, rdotchung not unless you hate diaspora 
134,rt blairwaldorfs some cannot accept consumers continue ask pay kn projects kaya they are still being given projects together 
135,rt fukada  white heart red envelope white heart amazon psswitch amazon paypay 
136,quinn played games total bears have worst roster top bottom post era without fields does year s team win single game 
137, dineshdsouza your worst nightmare ass hole
138,rt unusual whales police car light breaking police car light have released full trading report politicians despite being worst market s 
139,rt twxnkk let us play little game start you decide how long stay locked up I will stop count hours eyes like  hours 
140,I am be honest skips tweet was not bad was wrong timing we hate him significant other much we not give af want him gone 
141,rt chartoc well since person already blocked me can give rundown how some leftist radfem really hate half po 
142,rt foivechxn he looks disgusted he defo scrolling twt right now 
143, jackcha zerohedge hundred points all while being one worst contributors emissions 
144,rt lamadre ton heure arrive hanouna toutes tes petites magouilles avec ta petite berdah et papa bollore vont éclatées au grand jour 
145, krishnanrohit I am those guys they are fighting misinfo track mainstream media loves equate  bitcoin hack security system unassailable as matter technology hate idiots who d use drive engagement despite not being cryptobro myself 
146,rt dc draino kevin mccarthy would really hate if verified picture him got around todayhe significant other america first 
147,rt kunikunt scaraarchive because even though he hides behind his angry shield he still incredibly sweet gentle very loving 
148,rt finelinevogue men who hate harry styles are biggest red flags prove me wrong
149,rt samstu not necessarily like nfl commissioner but his worst fear was almost confirmed last night agree him one thi 
150,
151, maiden many wooers t p ie r loften chooses worst  
152,rt unusual whales police car light breaking police car light have released full trading report politicians despite being worst market s 
153, havaianaseurope I have spoken someone already but customer service worst I have ever experienced
154, hate when people ask what wrong but then they not actually care about an answer like why did you ask first place
155,rt mannydain stop getting upset about things you cannot control 
156, reggiebush realskipbayless be fair he did say which suddenly seems significant other irrelevant but guess reading comprehending too hard people or maybe because people want hate skip significant other bad they any blind chance 
157, charlenemarieo onedakinehowlie tgnoble karmaohara drandrewb not feed trolls he only has followers reason man could not even get an elementary sized classroom full kids listen his opinions but he twitter face with tears of joy face with tears of joy loudly crying face loudly crying face rolling on the floor laughing rolling on the floor laughing charlenemarieo would not even bother angry bird tweeter woozy face woozy face loudly crying face loudly crying face 
158, worst feeling world when your hero s pass away ken block pretty much single handedly influenced an entire generation motorsports car enthusiasts did things car we all dream about doing legend forever green heart yellow heart chequered flag 
159,rt babyraikan clearly vid ohm look significant other angry they are fighting I am curious why fans keep saying ohm was tire 
160,he seems upset know am no we qre not going talk like two adults if could wouldnt now be tweeting as last decade my life circles drain sigh 
161,rt dmmovies shehnaazgill gururandhawa s music video moonrise s first poster out however some fans have been left upset 
162,rt sussexdetective can become good reaction meme everytime see angry racist brits my mentions laughing out loud 
163,rt jayruies director try look angryheeseung 
164,im like minecraft diorite you either love me or you hate me
165,rt dc draino kevin mccarthy would really hate if verified picture him got around todayhe significant other america first 
166,rt filmibeat here s why shehnaazgill s fans are upset guru randhawa s new music album shehnaazgiil gururandhawana moonrise ht 
167, gaslyy très bonne décision dis donc hâte d entendre ta douce voix mielleuse smiling face with sunglasses 
168, hate people shitty recommendations like how did me liking ethel cain lead you recommending me camila cabello what was correlation between two 
169,rt feyerabender hate shit man 
170,these niggas be worst studio stop wasting greatness flex 
171,rt starboy today congress made their worst blunder n exposed itself completely former raw chief as dulat joined bharat jodo yatra t 
172,rt kaylan tx worst tweet significant other far congratulations pagnattijrespn 
173, tshadowknow acrytearsmag jkoff mickmazzo kelledin jammingontheone blueselmwood patriot gypsy againmothra magaphoenix digimalice tip ct pismojado blueresin klhu vincegottalotta trumpcrazytrain synyster lordbutters craigcastleber karlton teekeemon angryfleas emerichathome educatingtrump webguytv tommiestephsyup trumplost tastymorsel ultraglamma crogers brulephd mistressredwasp craig thetennpatriot collusiontech billenjoylife section kleeontheright angry mema missledu jonrfleming beastoforem nobusinessyours inugamiz kimmsue hofountains trumpster caperloo earthone he makes up craziest pile of poo 
174,rt baujidesi while image khakee already not good often people khakee make worst by their action pnb employee deogarh 
175,rt rahul forpm rupee becomes worst performing currency asia 
176,rt dylan dream maker confessions will make you hate me  sa totoo lang mas magiging successful yung final line up dito sa 
177, angry staffer will he refuse leave stage rally outside congress 
178, know I am going get angry comments from some most annoying people internet but winning billion dollars lottery better than making billion dollars as some corporate ghoul because you are not exploiting bunch people money
179,rt sheyman sznn transfer worst transfer all time 
180,rt david osland thanks brexit brits can work longest hours europe worst employment rights europe until they rea 
181,rt seavixen hate think how lot would survive state pension less than okay year drivers  week want more 
182,rt missapprop imagine if deer s worst predator was their own males sounds preposterous but reality human women childre 
183, police car light damnit not ken block what hell going  hate here pensive face pensive face pensive face 
184,point of view he feminist who immigrated from country known their misogyny hate feminists amp being safe haven sex offenders date or friend him not sorry but him seeing women as human beings not much turn  bare minimum 
185,rt pridenprcjudice things hate about you 
186,rt gyeoulbbh lee zii jia s draw first three tournaments  pmo r kodai india open r vito im r q yuq 
187,rt pridenprcjudice things hate about you 
188, hate rude dry attitude having ass people
189,kiss me like you love me fuck me like you hate me
190, am disgusted some people social media audacity you all post body pic caption dad bod when you are clearly shape good you being shape but let us not try change what dad bod looks like face with rolling eyes stop 
191,rt itstobiaf I have realized many men not see misogyny as systemic thing they think women are angry about random things 
192, not hit people when I am angry still train when feel lazy list goes  take control your own mind make right call regardless feeling unlimited possibility awaits tate
193, rinnosukeetqw goawaycrackhead chipenguin wileysr emeraldrobinson not get people spew hate call everyone moron then tuck tail delete tweets unreal block plenty people but not delete anything out there said meant time 
194,rt rnjudyflorida hands down president biden inherited worst mess american history zero transition thankful such an e 
195,rt bswirlsi mgtow still matters he has not been held fire enough about  years he sent out message group men who ha 
196,rt millanoire my fucking boss fortnite default danced me after giving me overtime am significant other angry he literally did front 
197,rt dc draino kevin mccarthy would really hate if verified picture him got around todayhe significant other america first 
198,rt chinnwee hate all soft life luxury life day life high value woman man feminine energy passenger princess healed l 
199,rt rabiasquared one hardest things about losing someone you love facing reality world does not stop grieve 
200,rt ashoswai vajpayee s man kashmir amp former raw chief as dulat former kashmir chief minister farooq abdullah join rahul gandhi s 
201,rt unusual whales police car light breaking police car light have released full trading report politicians despite being worst market s 
202,hate seeing couples my tl
203,rt oromiafinfine worst genocide happening oromia by terrorist amhara fano edf endf amp regional states forces terrori 
204,rt angeliinax who has worst mediaplay 
205,rt justketh wish im guy no matter fuck up things you you will always gonna get more or less support cause world hate women 
206,rt brat princess be pussy free  not let happen you girls hate you they only want make content you thei 
207,rt akashpanditign  reliancejio india s best mobile connecticity provider world s worst jiocare service executives raised po 
208,rt mattxiv people like steven crowder will see fat person tell them they should exercise get healthier then they 
209, rbarbosa twice because ligasure sucks actually does not stop bleeding laughing out loud use reusable bipolar amp refurbished harmonic instead hate residents are taught buzz buzz buzz 
210,rt rathiiyer one my besti did same me after he showed me video was shocked angry but felt good erotic after onl 
211,laughing out loud you hate me bad hope you bitches know ian even started yet face with tears of joy smiling face with hearts 
212,rt armyreportbr police car light perfil hate massivo direcionado todos os membros repetir denúncia de  vezes por conta forma de den 
